continent,title,url,summary
North America,US consumer sentiment improves,https://example.com/us1,Consumers more optimistic as inflation cools
North America,Tech stocks rebound,https://example.com/us2,Large-cap tech leads gains
Europe,Germany industrial output slows,https://example.com/de1,Manufacturing shows mixed signals
Asia,South Korea export growth accelerates,https://example.com/kr1,Semiconductors drive surprise upside
Asia,Japan eases travel curbs,https://example.com/jp1,Inbound tourism boost expected
South America,Brazil pushes infrastructure bill,https://example.com/br1,Spending targets logistics and energy
